{
  "harnessVersion": "math-practice-v1",
  "generatedAt": "2026-06-08",
  "curriculum": {
    "country": "KR",
    "name": "2022 개정 교육과정",
    "course": "공통수학1",
    "gradeBand": "고1"
  },
  "unit": {
    "sequence": 1,
    "title": "다항식",
    "slug": "polynomials",
    "subtopics": ["다항식의 연산", "항등식과 나머지정리", "인수분해"]
  },
  "taxonomy": {
    "categoryPath": "Algebra > Elementary Algebra > Polynomials",
    "categoryLevel1": 1,
    "categoryLevel2": 11,
    "defaultCategoryLevel3": 45
  },
  "outputs": {
    "markdown": "generated/high_school_math_unit_01_polynomials_2026-06-08.md",
    "html": "generated/high_school_math_unit_01_polynomials_2026-06-08.html"
  },
  "stages": [
    {
      "id": "U01-S01",
      "order": 1,
      "title": "다항식의 연산",
      "goal": "동류항 정리, 전개, 나눗셈을 정확히 수행한다.",
      "concepts": ["동류항 정리", "전개", "다항식 나눗셈", "조립제법"]
    },
    {
      "id": "U01-S02",
      "order": 2,
      "title": "항등식과 나머지정리",
      "goal": "항등식의 계수 비교와 나머지정리, 인수정리를 적용한다.",
      "concepts": ["항등식", "계수 비교", "나머지정리", "인수정리"]
    },
    {
      "id": "U01-S03",
      "order": 3,
      "title": "인수분해",
      "goal": "이차식과 삼차식을 적절한 방법으로 인수분해한다.",
      "concepts": ["이차식 인수분해", "교차곱", "공통인수", "차의 제곱"]
    },
    {
      "id": "U01-S04",
      "order": 4,
      "title": "종합 적용",
      "goal": "여러 조건을 결합해 계수를 결정하고 나머지를 구한다.",
      "concepts": ["완전 인수분해", "계수 결정", "나머지정리의 확장", "연립방정식"]
    }
  ],
  "problems": [
    {
      "id": "U01-P001",
      "order": 1,
      "stageId": "U01-S01",
      "title": "다항식의 덧셈과 뺄셈",
      "content": "다음 식을 간단히 하여라. \\\\[(2x^2-3x+1)+(x^2+5x-4)-2(x^2-x+3)\\\\]",
      "answer": "\\\\(x^2+4x-9\\\\)",
      "solution": "동류항을 정리하면 \\\\(3x^2+2x-3-2x^2+2x-6=x^2+4x-9\\\\)이다.",
      "difficulty": { "score": 2, "band": "Basic" },
      "category": { "level1": 1, "level2": 11, "level3": 45, "path": "Algebra > Elementary Algebra > Polynomials" },
      "concepts": ["동류항 정리"],
      "tags": ["공통수학1", "다항식", "연산", "동류항"],
      "isBonus": false,
      "relationships": { "prerequisiteProblemIds": [], "nextProblemId": "U01-P002" },
      "validation": { "answerCheckType": "manual", "expectedAnswer": "x^2+4x-9" }
    },
    {
      "id": "U01-P002",
      "order": 2,
      "stageId": "U01-S01",
      "title": "다항식의 곱셈",
      "content": "다음 식을 전개하여라. \\\\[(x-2)(x+3)(2x-1)\\\\]",
      "answer": "\\\\(2x^3+x^2-13x+6\\\\)",
      "solution": "\\\\((x-2)(x+3)=x^2+x-6\\\\)이므로 \\\\((x^2+x-6)(2x-1)=2x^3+x^2-13x+6\\\\)이다.",
      "difficulty": { "score": 3, "band": "Core" },
      "category": { "level1": 1, "level2": 11, "level3": 45, "path": "Algebra > Elementary Algebra > Polynomials" },
      "concepts": ["전개"],
      "tags": ["공통수학1", "다항식", "전개", "곱셈"],
      "isBonus": false,
      "relationships": { "prerequisiteProblemIds": ["U01-P001"], "nextProblemId": "U01-P003" },
      "validation": { "answerCheckType": "manual", "expectedAnswer": "2x^3+x^2-13x+6" }
    },
    {
      "id": "U01-P003",
      "order": 3,
      "stageId": "U01-S01",
      "title": "다항식의 나눗셈",
      "content": "\\\\(3x^3-2x^2+5x-7\\\\)을 \\\\(x-2\\\\)로 나누었을 때의 몫과 나머지를 구하여라.",
      "answer": "몫 \\\\(3x^2+4x+13\\\\), 나머지 \\\\(19\\\\)",
      "solution": "조립제법에서 계수 \\\\(3,-2,5,-7\\\\)에 \\\\(2\\\\)를 대입하면 몫은 \\\\(3x^2+4x+13\\\\), 나머지는 \\\\(19\\\\)이다.",
      "difficulty": { "score": 3, "band": "Core" },
      "category": { "level1": 1, "level2": 11, "level3": 45, "path": "Algebra > Elementary Algebra > Polynomials" },
      "concepts": ["조립제법", "몫과 나머지"],
      "tags": ["공통수학1", "다항식", "나눗셈", "조립제법"],
      "isBonus": false,
      "relationships": { "prerequisiteProblemIds": ["U01-P002"], "nextProblemId": "U01-P004" },
      "validation": { "answerCheckType": "manual", "expectedAnswer": "quotient=3x^2+4x+13; remainder=19" }
    },
    {
      "id": "U01-P004",
      "order": 4,
      "stageId": "U01-S02",
      "title": "나머지정리의 기본",
      "content": "\\\\(f(x)=x^3+ax^2-4x+5\\\\)를 \\\\(x-1\\\\)로 나누었을 때의 나머지가 \\\\(3\\\\)이다. 상수 \\\\(a\\\\)를 구하여라.",
      "answer": "\\\\(a=1\\\\)",
      "solution": "나머지정리에 의해 \\\\(f(1)=3\\\\)이다. 따라서 \\\\(1+a-4+5=a+2=3\\\\)이므로 \\\\(a=1\\\\)이다.",
      "difficulty": { "score": 3, "band": "Core" },
      "category": { "level1": 1, "level2": 11, "level3": 45, "path": "Algebra > Elementary Algebra > Polynomials" },
      "concepts": ["나머지정리"],
      "tags": ["공통수학1", "다항식", "나머지정리"],
      "isBonus": false,
      "relationships": { "prerequisiteProblemIds": ["U01-P003"], "nextProblemId": "U01-P005" },
      "validation": { "answerCheckType": "manual", "expectedAnswer": "a=1" }
    },
    {
      "id": "U01-P005",
      "order": 5,
      "stageId": "U01-S02",
      "title": "항등식의 계수 비교",
      "content": "다음 등식이 항등식일 때, 상수 \\\\(a,b\\\\)를 구하여라. \\\\[x^3+ax^2+bx-6=(x-2)(x^2+3x+3)\\\\]",
      "answer": "\\\\(a=1, b=-3\\\\)",
      "solution": "오른쪽을 전개하면 \\\\(x^3+x^2-3x-6\\\\)이다. 계수를 비교하여 \\\\(a=1, b=-3\\\\)이다.",
      "difficulty": { "score": 4, "band": "Core" },
      "category": { "level1": 1, "level2": 11, "level3": 45, "path": "Algebra > Elementary Algebra > Polynomials" },
      "concepts": ["항등식", "계수 비교"],
      "tags": ["공통수학1", "다항식", "항등식", "계수비교"],
      "isBonus": false,
      "relationships": { "prerequisiteProblemIds": ["U01-P002"], "nextProblemId": "U01-P006" },
      "validation": { "answerCheckType": "manual", "expectedAnswer": "a=1, b=-3" }
    },
    {
      "id": "U01-P006",
      "order": 6,
      "stageId": "U01-S02",
      "title": "인수정리의 기본",
      "content": "\\\\(f(x)=2x^3-3x^2+kx+4\\\\)가 \\\\(x+1\\\\)을 인수로 가질 때, 상수 \\\\(k\\\\)를 구하여라.",
      "answer": "\\\\(k=-1\\\\)",
      "solution": "\\\\(x+1\\\\)이 인수이면 \\\\(f(-1)=0\\\\)이다. \\\\(-2-3-k+4=-1-k=0\\\\)이므로 \\\\(k=-1\\\\)이다.",
      "difficulty": { "score": 4, "band": "Core" },
      "category": { "level1": 1, "level2": 11, "level3": 45, "path": "Algebra > Elementary Algebra > Polynomials" },
      "concepts": ["인수정리"],
      "tags": ["공통수학1", "다항식", "인수정리", "나머지정리"],
      "isBonus": false,
      "relationships": { "prerequisiteProblemIds": ["U01-P004"], "nextProblemId": "U01-P007" },
      "validation": { "answerCheckType": "manual", "expectedAnswer": "k=-1" }
    },
    {
      "id": "U01-P007",
      "order": 7,
      "stageId": "U01-S03",
      "title": "이차식의 인수분해",
      "content": "다음 식을 인수분해하여라. \\\\[x^2+7x+12\\\\]",
      "answer": "\\\\((x+3)(x+4)\\\\)",
      "solution": "곱이 \\\\(12\\\\), 합이 \\\\(7\\\\)인 두 수는 \\\\(3,4\\\\)이다.",
      "difficulty": { "score": 2, "band": "Basic" },
      "category": { "level1": 1, "level2": 11, "level3": 47, "path": "Algebra > Elementary Algebra > Factorization" },
      "concepts": ["이차식 인수분해"],
      "tags": ["공통수학1", "인수분해", "이차식"],
      "isBonus": false,
      "relationships": { "prerequisiteProblemIds": [], "nextProblemId": "U01-P008" },
      "validation": { "answerCheckType": "manual", "expectedAnswer": "(x+3)(x+4)" }
    },
    {
      "id": "U01-P008",
      "order": 8,
      "stageId": "U01-S03",
      "title": "계수가 있는 이차식의 인수분해",
      "content": "다음 식을 인수분해하여라. \\\\[2x^2-5x-3\\\\]",
      "answer": "\\\\((2x+1)(x-3)\\\\)",
      "solution": "교차곱을 확인하면 \\\\((2x+1)(x-3)=2x^2-5x-3\\\\)이다.",
      "difficulty": { "score": 3, "band": "Core" },
      "category": { "level1": 1, "level2": 11, "level3": 47, "path": "Algebra > Elementary Algebra > Factorization" },
      "concepts": ["계수가 있는 이차식 인수분해"],
      "tags": ["공통수학1", "인수분해", "이차식", "교차곱"],
      "isBonus": false,
      "relationships": { "prerequisiteProblemIds": ["U01-P007"], "nextProblemId": "U01-P009" },
      "validation": { "answerCheckType": "manual", "expectedAnswer": "(2x+1)(x-3)" }
    },
    {
      "id": "U01-P009",
      "order": 9,
      "stageId": "U01-S03",
      "title": "묶어서 인수분해",
      "content": "다음 식을 인수분해하여라. \\\\[x^3-2x^2-9x+18\\\\]",
      "answer": "\\\\((x-2)(x-3)(x+3)\\\\)",
      "solution": "\\\\(x^2(x-2)-9(x-2)=(x-2)(x^2-9)=(x-2)(x-3)(x+3)\\\\)이다.",
      "difficulty": { "score": 4, "band": "Core" },
      "category": { "level1": 1, "level2": 11, "level3": 47, "path": "Algebra > Elementary Algebra > Factorization" },
      "concepts": ["공통인수", "차의 제곱"],
      "tags": ["공통수학1", "인수분해", "삼차식", "공통인수"],
      "isBonus": false,
      "relationships": { "prerequisiteProblemIds": ["U01-P007", "U01-P008"], "nextProblemId": "U01-P010" },
      "validation": { "answerCheckType": "manual", "expectedAnswer": "(x-2)(x-3)(x+3)" }
    },
    {
      "id": "U01-P010",
      "order": 10,
      "stageId": "U01-S04",
      "title": "삼차식의 완전 인수분해",
      "content": "다음 식을 인수분해하여라. \\\\[x^3+3x^2-4x-12\\\\]",
      "answer": "\\\\((x+3)(x-2)(x+2)\\\\)",
      "solution": "\\\\(x^2(x+3)-4(x+3)=(x+3)(x^2-4)=(x+3)(x-2)(x+2)\\\\)이다.",
      "difficulty": { "score": 5, "band": "Application" },
      "category": { "level1": 1, "level2": 11, "level3": 47, "path": "Algebra > Elementary Algebra > Factorization" },
      "concepts": ["묶기", "완전 인수분해"],
      "tags": ["공통수학1", "인수분해", "삼차식", "종합"],
      "isBonus": false,
      "relationships": { "prerequisiteProblemIds": ["U01-P009"], "nextProblemId": "U01-P011" },
      "validation": { "answerCheckType": "manual", "expectedAnswer": "(x+3)(x-2)(x+2)" }
    },
    {
      "id": "U01-P011",
      "order": 11,
      "stageId": "U01-S04",
      "title": "두 조건을 만족하는 다항식",
      "content": "\\\\(f(x)=x^3+px^2+qx+6\\\\)가 \\\\(x-1\\\\)과 \\\\(x+2\\\\)를 모두 인수로 가진다. 상수 \\\\(p,q\\\\)를 구하여라.",
      "answer": "\\\\(p=-2, q=-5\\\\)",
      "solution": "\\\\(f(1)=0\\\\)에서 \\\\(p+q+7=0\\\\), \\\\(f(-2)=0\\\\)에서 \\\\(2p-q-1=0\\\\)이다. 연립하면 \\\\(p=-2, q=-5\\\\)이다.",
      "difficulty": { "score": 6, "band": "Application" },
      "category": { "level1": 1, "level2": 11, "level3": 45, "path": "Algebra > Elementary Algebra > Polynomials" },
      "concepts": ["인수정리", "연립방정식", "계수 결정"],
      "tags": ["공통수학1", "다항식", "인수정리", "연립방정식"],
      "isBonus": false,
      "relationships": { "prerequisiteProblemIds": ["U01-P004", "U01-P006"], "nextProblemId": "U01-P012" },